number,value,datetime_start,datetime_complete,duration,params_batch_size,params_dropout,params_hidden,params_layers,params_lr,params_pool,params_weight_decay,state
0,0.5256987722456902,2026-04-22 06:48:45.992822,2026-04-22 06:48:51.786098,0 days 00:00:05.793276,128,0.2232334448672798,24,1,0.00190303683817358,last,0.0006358358856676254,COMPLETE
1,0.5182400709858472,2026-04-22 06:48:51.786149,2026-04-22 06:49:10.066841,0 days 00:00:18.280692,64,0.25579754426081674,32,2,0.00027010527749605503,mean,0.00012562773503807024,COMPLETE
2,0.515489867525668,2026-04-22 06:49:10.066902,2026-04-22 06:49:18.475281,0 days 00:00:08.408379,128,0.3218455076693483,48,1,0.00013940346079873228,mean,0.0011290133559092666,COMPLETE
3,0.5259420010038788,2026-04-22 06:49:18.475335,2026-04-22 06:49:34.674623,0 days 00:00:16.199288,64,0.5100531293444458,16,2,0.002442046084491142,max,0.004835952776465951,COMPLETE
4,0.5322457128291463,2026-04-22 06:49:34.674677,2026-04-22 06:50:13.064720,0 days 00:00:38.390043,32,0.25636968998990506,32,2,0.0015308837415731389,mean,1.6736010167825783e-05,COMPLETE
5,0.5091439960632733,2026-04-22 06:50:13.064784,2026-04-22 06:50:25.792429,0 days 00:00:12.727645,128,0.4493192507310232,24,2,0.0003081601704446808,mean,1.551225912648474e-05,COMPLETE
6,0.5006452182525262,2026-04-22 06:50:25.792484,2026-04-22 06:50:33.675497,0 days 00:00:07.883013,128,0.4090931317527976,32,1,0.0004280849161757092,max,1.1919481947918725e-05,COMPLETE
7,0.5415202382297422,2026-04-22 06:50:33.675551,2026-04-22 06:50:49.579329,0 days 00:00:15.903778,64,0.26448851490160175,32,2,0.0023619797107806506,mean,0.002656813924114493,COMPLETE
8,0.5152541161165226,2026-04-22 06:50:49.579386,2026-04-22 06:51:19.906200,0 days 00:00:30.326814,32,0.5272059063689972,24,2,0.0018681142751959697,max,1.0491954332267901e-05,COMPLETE
9,0.5179780874404927,2026-04-22 06:51:19.906267,2026-04-22 06:51:29.190075,0 days 00:00:09.283808,128,0.3007129183301457,32,1,0.0005426206745606975,last,7.991621920384351e-05,COMPLETE
10,0.5206028602211927,2026-04-22 06:51:29.190132,2026-04-22 06:51:43.943413,0 days 00:00:14.753281,64,0.34749150908843895,48,2,0.0009807210744879143,mean,0.008794181893206379,COMPLETE
11,0.5237049418002855,2026-04-22 06:51:43.943468,2026-04-22 06:52:07.149442,0 days 00:00:23.205974,32,0.20290616077889656,32,2,0.0011511579879447053,mean,0.0021240029415411006,COMPLETE
12,0.534563200923946,2026-04-22 06:52:07.149496,2026-04-22 06:52:33.976642,0 days 00:00:26.827146,32,0.2837885337149462,32,2,0.0029873391364590276,mean,0.000159754267808109,COMPLETE
13,0.5277078901025458,2026-04-22 06:52:33.976697,2026-04-22 06:53:08.013662,0 days 00:00:34.036965,32,0.37597488678652274,16,2,0.0029160971759410025,mean,0.00018561860486787592,COMPLETE
14,0.5177707322383125,2026-04-22 06:53:08.013717,2026-04-22 06:53:33.263011,0 days 00:00:25.249294,64,0.5997449754566205,32,2,0.0011104760462250331,mean,5.420818643180641e-05,COMPLETE
15,0.530576322629889,2026-04-22 06:53:33.263064,2026-04-22 06:54:08.856347,0 days 00:00:35.593283,32,0.28545507422756705,32,2,0.002951196669258293,last,0.0004631370025011624,COMPLETE
16,0.5201441841208254,2026-04-22 06:54:08.856400,2026-04-22 06:54:37.024137,0 days 00:00:28.167737,64,0.41158411924730104,32,2,0.0007711082118253128,mean,0.002290253815359094,COMPLETE
17,0.5153133040046111,2026-04-22 06:54:37.024191,2026-04-22 06:55:21.019571,0 days 00:00:43.995380,32,0.33932971302161197,48,2,0.0001054170150948174,mean,0.0008683258320598538,COMPLETE
18,0.5163717563951901,2026-04-22 06:55:21.019624,2026-04-22 06:55:34.115934,0 days 00:00:13.096310,64,0.25720892331076084,16,1,0.0015456799764017241,max,0.00025829506436372124,COMPLETE
19,0.5072657655579647,2026-04-22 06:55:34.115989,2026-04-22 06:56:05.625292,0 days 00:00:31.509303,32,0.3721808331614443,32,2,0.0008066911722287792,last,3.467512502489103e-05,PRUNED
20,0.5439495939658662,2026-04-22 06:56:05.625324,2026-04-22 06:56:24.152431,0 days 00:00:18.527107,64,0.28767120734269314,32,2,0.0022818440344001246,mean,0.0025712270232524765,COMPLETE
21,0.5312112103496556,2026-04-22 06:56:24.152489,2026-04-22 06:56:39.396624,0 days 00:00:15.244135,64,0.2916622345023855,32,2,0.0021703142467721748,mean,0.0021200561494309606,COMPLETE
22,0.5262738387163867,2026-04-22 06:56:39.396676,2026-04-22 06:56:55.499659,0 days 00:00:16.102983,64,0.2336241815484632,32,2,0.0015839503203003973,mean,0.004263867469852598,COMPLETE
23,0.5412520124777959,2026-04-22 06:56:55.499723,2026-04-22 06:57:14.661107,0 days 00:00:19.161384,64,0.3099520697690501,32,2,0.0029813333583615757,mean,0.0014646476648127094,COMPLETE
24,0.5308418926438533,2026-04-22 06:57:14.661161,2026-04-22 06:57:27.432924,0 days 00:00:12.771763,64,0.3231288901825442,32,2,0.0013923096730099548,mean,0.001266568322828077,COMPLETE
25,0.5295481196126365,2026-04-22 06:57:27.432979,2026-04-22 06:57:37.758301,0 days 00:00:10.325322,64,0.44471457180469126,32,2,0.0021127345492721935,mean,0.004429229671881832,COMPLETE
26,0.529517933117557,2026-04-22 06:57:37.758355,2026-04-22 06:57:48.934609,0 days 00:00:11.176254,64,0.35484192447457896,48,1,0.0021788359715061924,mean,0.008149658576652717,COMPLETE
27,0.5346446892371688,2026-04-22 06:57:48.934662,2026-04-22 06:58:15.084753,0 days 00:00:26.150091,64,0.20508436314856993,24,2,0.0007777760701836603,last,0.0004257905306871947,COMPLETE
28,0.5205514830045493,2026-04-22 06:58:15.084817,2026-04-22 06:58:34.201210,0 days 00:00:19.116393,64,0.26213121505353293,16,2,0.0012630269323774005,max,0.003080398641529664,PRUNED
29,0.528296371068129,2026-04-22 06:58:34.201258,2026-04-22 06:58:54.292644,0 days 00:00:20.091386,64,0.2299727415870234,24,1,0.002436197382382345,mean,0.0006775571449133024,COMPLETE
