number,value,datetime_start,datetime_complete,duration,params_batch_size,params_dropout,params_hidden,params_layers,params_lr,params_pool,params_weight_decay,state
0,0.531660551467474,2026-04-22 10:04:31.075784,2026-04-22 10:04:36.718505,0 days 00:00:05.642721,128,0.2232334448672798,24,1,0.00190303683817358,last,0.0006358358856676254,COMPLETE
1,0.5261680898844971,2026-04-22 10:04:36.718565,2026-04-22 10:05:12.769473,0 days 00:00:36.050908,64,0.25579754426081674,32,2,0.00027010527749605503,mean,0.00012562773503807024,COMPLETE
2,0.5215537041329965,2026-04-22 10:05:12.769529,2026-04-22 10:05:24.369748,0 days 00:00:11.600219,128,0.3218455076693483,48,1,0.00013940346079873228,mean,0.0011290133559092666,COMPLETE
3,0.5356770799924379,2026-04-22 10:05:24.369804,2026-04-22 10:05:45.181501,0 days 00:00:20.811697,64,0.5100531293444458,16,2,0.002442046084491142,max,0.004835952776465951,COMPLETE
4,0.5428980614953697,2026-04-22 10:05:45.181561,2026-04-22 10:06:09.129112,0 days 00:00:23.947551,32,0.25636968998990506,32,2,0.0015308837415731389,mean,1.6736010167825783e-05,COMPLETE
5,0.5197972567580921,2026-04-22 10:06:09.129168,2026-04-22 10:06:24.617176,0 days 00:00:15.488008,128,0.4493192507310232,24,2,0.0003081601704446808,mean,1.551225912648474e-05,COMPLETE
6,0.5270017099929558,2026-04-22 10:06:24.617247,2026-04-22 10:06:40.125705,0 days 00:00:15.508458,128,0.4090931317527976,32,1,0.0004280849161757092,max,1.1919481947918725e-05,COMPLETE
7,0.5435565540108491,2026-04-22 10:06:40.125759,2026-04-22 10:06:56.394712,0 days 00:00:16.268953,64,0.26448851490160175,32,2,0.0023619797107806506,mean,0.002656813924114493,COMPLETE
8,0.5394998739784687,2026-04-22 10:06:56.394766,2026-04-22 10:07:30.792683,0 days 00:00:34.397917,32,0.5272059063689972,24,2,0.0018681142751959697,max,1.0491954332267901e-05,COMPLETE
9,0.5412631719354408,2026-04-22 10:07:30.792738,2026-04-22 10:07:38.153118,0 days 00:00:07.360380,128,0.3007129183301457,32,1,0.0005426206745606975,last,7.991621920384351e-05,PRUNED
10,0.5447180857157183,2026-04-22 10:07:38.153149,2026-04-22 10:08:00.442303,0 days 00:00:22.289154,64,0.34749150908843895,48,2,0.0009807210744879143,mean,0.008794181893206379,COMPLETE
11,0.5515877203206137,2026-04-22 10:08:00.442359,2026-04-22 10:08:19.579084,0 days 00:00:19.136725,64,0.3518416973680894,48,2,0.0010609115786206938,mean,0.00802610670187857,COMPLETE
12,0.5408056051747703,2026-04-22 10:08:19.579138,2026-04-22 10:08:44.508547,0 days 00:00:24.929409,64,0.3604822409543777,48,2,0.000990068669005758,mean,0.007179088481271028,COMPLETE
13,0.5429124503485048,2026-04-22 10:08:44.508602,2026-04-22 10:09:02.436272,0 days 00:00:17.927670,64,0.3984165248678857,48,2,0.0008454827178799088,mean,0.009360707553903523,COMPLETE
14,0.5719687875150059,2026-04-22 10:09:02.436328,2026-04-22 10:09:24.436345,0 days 00:00:22.000017,64,0.5997449754566205,48,2,0.0010181511738028188,mean,0.001896944143788782,PRUNED
15,0.556342537014806,2026-04-22 10:09:24.436377,2026-04-22 10:09:44.978498,0 days 00:00:20.542121,64,0.3280863256834777,48,2,0.0012466736815396461,last,0.0031437526143240782,PRUNED
16,0.5606909430438842,2026-04-22 10:09:44.978545,2026-04-22 10:10:03.195058,0 days 00:00:18.216513,64,0.38093052515104336,16,2,0.0008027619536484554,mean,0.00037405108411146527,PRUNED
17,0.5663732159530478,2026-04-22 10:10:03.195093,2026-04-22 10:10:53.741065,0 days 00:00:50.545972,32,0.46293197940339287,48,2,0.0007140543742913117,mean,0.0008832219187185327,PRUNED
18,0.5657596371882087,2026-04-22 10:10:53.741100,2026-04-22 10:11:13.364384,0 days 00:00:19.623284,64,0.3424836272841992,48,1,0.000483621622562576,max,0.009400497036265054,PRUNED
19,0.5478458049886621,2026-04-22 10:11:13.364415,2026-04-22 10:11:52.974377,0 days 00:00:39.609962,64,0.4438057302504088,48,2,0.00015259146747200473,last,0.00010897201724696731,PRUNED
20,0.5527944511137788,2026-04-22 10:11:52.974423,2026-04-22 10:12:32.930248,0 days 00:00:39.955825,32,0.28767120734269314,16,2,0.0003410098377122444,mean,0.003734053772947436,PRUNED
21,0.5748366013071896,2026-04-22 10:12:32.930281,2026-04-22 10:12:47.970811,0 days 00:00:15.040530,64,0.2684686736690093,32,2,0.0024425167194313817,mean,0.0024688434457888347,PRUNED
22,0.5482253395694388,2026-04-22 10:12:47.970844,2026-04-22 10:13:01.998494,0 days 00:00:14.027650,64,0.20279903622647819,32,2,0.0013631418961655099,mean,0.0051338399051783215,COMPLETE
23,0.5444577831132453,2026-04-22 10:13:01.998565,2026-04-22 10:13:17.491434,0 days 00:00:15.492869,64,0.2011834230244996,48,2,0.001344573148332928,mean,0.00537415398359838,PRUNED
24,0.5400574003261978,2026-04-22 10:13:17.491467,2026-04-22 10:13:38.078437,0 days 00:00:20.586970,64,0.21979160368540973,48,2,0.000721628465602573,mean,0.0016176302658366727,COMPLETE
25,0.5406757246488633,2026-04-22 10:13:38.078492,2026-04-22 10:13:59.172812,0 days 00:00:21.094320,64,0.42513233345612556,32,2,0.0011758665929717167,mean,0.005575459005086509,COMPLETE
26,0.5763705482192877,2026-04-22 10:13:59.172872,2026-04-22 10:14:11.983510,0 days 00:00:12.810638,64,0.3582920694240212,24,1,0.00297429392865237,mean,0.0003029163661440257,PRUNED
27,0.5413567973244495,2026-04-22 10:14:11.983541,2026-04-22 10:14:33.352647,0 days 00:00:21.369106,64,0.299947332324165,16,2,0.0017091066801060853,mean,0.009778757243624944,COMPLETE
28,0.5563625450180072,2026-04-22 10:14:33.352700,2026-04-22 10:15:05.768565,0 days 00:00:32.415865,32,0.379671680012915,48,2,0.0010057298127558922,last,0.004178327964426126,PRUNED
29,0.5439842603708149,2026-04-22 10:15:05.768611,2026-04-22 10:15:31.190310,0 days 00:00:25.421699,64,0.48373817644490086,24,1,0.00010318527292832798,max,0.00039484312351083315,PRUNED
