number,value,datetime_start,datetime_complete,duration,params_batch_size,params_dropout,params_hidden,params_layers,params_lr,params_pool,params_weight_decay,state
0,0.5186108163811992,2026-04-22 05:44:31.666052,2026-04-22 05:44:40.462725,0 days 00:00:08.796673,128,0.2232334448672798,24,1,0.00190303683817358,last,0.0006358358856676254,COMPLETE
1,0.5173218356589335,2026-04-22 05:44:40.462782,2026-04-22 05:45:06.634428,0 days 00:00:26.171646,64,0.25579754426081674,32,2,0.00027010527749605503,mean,0.00012562773503807024,COMPLETE
2,0.5137727781174851,2026-04-22 05:45:06.634482,2026-04-22 05:45:16.690096,0 days 00:00:10.055614,128,0.3218455076693483,48,1,0.00013940346079873228,mean,0.0011290133559092666,COMPLETE
3,0.5311407385777612,2026-04-22 05:45:16.690151,2026-04-22 05:45:39.506263,0 days 00:00:22.816112,64,0.5100531293444458,16,2,0.002442046084491142,max,0.004835952776465951,COMPLETE
4,0.5376041820044335,2026-04-22 05:45:39.506324,2026-04-22 05:46:03.686921,0 days 00:00:24.180597,32,0.25636968998990506,32,2,0.0015308837415731389,mean,1.6736010167825783e-05,COMPLETE
5,0.5417684804418221,2026-04-22 05:46:03.686975,2026-04-22 05:46:15.342565,0 days 00:00:11.655590,128,0.4493192507310232,24,2,0.0003081601704446808,mean,1.551225912648474e-05,PRUNED
6,0.5187537601448511,2026-04-22 05:46:15.342597,2026-04-22 05:46:28.935194,0 days 00:00:13.592597,128,0.4090931317527976,32,1,0.0004280849161757092,max,1.1919481947918725e-05,COMPLETE
7,0.534022337462521,2026-04-22 05:46:28.935279,2026-04-22 05:46:46.625302,0 days 00:00:17.690023,64,0.26448851490160175,32,2,0.0023619797107806506,mean,0.002656813924114493,COMPLETE
8,0.5381532372328592,2026-04-22 05:46:46.625355,2026-04-22 05:47:05.998867,0 days 00:00:19.373512,32,0.5272059063689972,24,2,0.0018681142751959697,max,1.0491954332267901e-05,COMPLETE
9,0.5265686474802127,2026-04-22 05:47:05.998921,2026-04-22 05:47:10.717623,0 days 00:00:04.718702,128,0.3007129183301457,32,1,0.0005426206745606975,last,7.991621920384351e-05,PRUNED
10,0.5483242942567099,2026-04-22 05:47:10.717654,2026-04-22 05:47:46.137581,0 days 00:00:35.419927,32,0.5878148443151463,24,2,0.0009807210744879143,max,7.31122986091168e-05,PRUNED
11,0.531925354270202,2026-04-22 05:47:46.137613,2026-04-22 05:48:15.096608,0 days 00:00:28.958995,32,0.5981281654343766,48,2,0.0011511579879447053,max,2.6513269570416758e-05,COMPLETE
12,0.5354452749570016,2026-04-22 05:48:15.096662,2026-04-22 05:48:47.303562,0 days 00:00:32.206900,32,0.35953468355875173,16,2,0.001039236944124102,mean,4.109510613546822e-05,COMPLETE
13,0.5364225293558755,2026-04-22 05:48:47.303616,2026-04-22 05:49:14.205242,0 days 00:00:26.901626,32,0.5036275293884735,24,2,0.0013923316814539568,max,0.0002647573637067346,COMPLETE
14,0.5380937813727497,2026-04-22 05:49:14.205302,2026-04-22 05:49:49.287635,0 days 00:00:35.082333,32,0.5199690201206848,32,2,0.0008394130713939595,last,1.1930220880472098e-05,COMPLETE
15,0.5381859599631814,2026-04-22 05:49:49.287695,2026-04-22 05:50:30.055951,0 days 00:00:40.768256,32,0.5219682666333011,24,2,0.0007797625044958505,last,1.0218065923188196e-05,PRUNED
16,0.5480263027196695,2026-04-22 05:50:30.055985,2026-04-22 05:51:02.931263,0 days 00:00:32.875278,32,0.4464369437835602,16,2,0.002880841955044088,last,3.798895757932489e-05,PRUNED
17,0.5549132182423797,2026-04-22 05:51:02.931295,2026-04-22 05:51:27.835905,0 days 00:00:24.904610,32,0.5478299596207398,48,2,0.0007942383092448929,last,0.0001609231751855327,PRUNED
18,0.5400931058002397,2026-04-22 05:51:27.835937,2026-04-22 05:52:05.600467,0 days 00:00:37.764530,32,0.46423969833138334,32,1,0.0006691633367870806,max,0.00047116602613549223,PRUNED
19,0.5486553959645324,2026-04-22 05:52:05.600502,2026-04-22 05:52:50.956678,0 days 00:00:45.356176,32,0.5610285403554311,24,2,0.00015259146747200473,last,2.7026344039745127e-05,PRUNED
20,0.5301270857430327,2026-04-22 05:52:50.956724,2026-04-22 05:53:07.239249,0 days 00:00:16.282525,64,0.377887709402979,24,2,0.0015135302716183933,max,7.216813936843093e-05,COMPLETE
21,0.536654688074472,2026-04-22 05:53:07.239302,2026-04-22 05:53:34.357630,0 days 00:00:27.118328,32,0.47660828879748257,32,2,0.001673215505889918,mean,1.882019355698382e-05,COMPLETE
22,0.5551449894378555,2026-04-22 05:53:34.357685,2026-04-22 05:53:58.480605,0 days 00:00:24.122920,32,0.2032172452720285,32,2,0.001758134777841857,last,1.1155810152002026e-05,PRUNED
23,0.5390127697105023,2026-04-22 05:53:58.480636,2026-04-22 05:54:27.743666,0 days 00:00:29.263030,32,0.4182314458317712,32,2,0.0011946346376024962,mean,3.9039017463858955e-05,COMPLETE
24,0.5422055346961481,2026-04-22 05:54:27.743721,2026-04-22 05:54:55.176771,0 days 00:00:27.433050,32,0.41635859253693475,32,2,0.0005002342058519474,last,4.2722443395409786e-05,PRUNED
25,0.5387495314274666,2026-04-22 05:54:55.176803,2026-04-22 05:55:29.208295,0 days 00:00:34.031492,32,0.5514508026332132,32,2,0.001217184027273494,mean,2.551845868242208e-05,COMPLETE
26,0.54506275368844,2026-04-22 05:55:29.208350,2026-04-22 05:55:51.719396,0 days 00:00:22.511046,32,0.5692878805362387,48,1,0.0012011284596707712,mean,2.4917520915259674e-05,COMPLETE
27,0.5399971818904936,2026-04-22 05:55:51.719465,2026-04-22 05:56:15.079362,0 days 00:00:23.359897,32,0.5648813210373155,48,1,0.001192109140828899,mean,0.00015892577785186137,COMPLETE
28,0.5449205687002934,2026-04-22 05:56:15.079416,2026-04-22 05:56:34.720387,0 days 00:00:19.640971,64,0.5735675718047194,48,1,0.00038251646240773825,mean,0.0002015518072439095,PRUNED
29,0.5340038608696351,2026-04-22 05:56:34.720420,2026-04-22 05:56:59.856924,0 days 00:00:25.136504,32,0.48680612049502614,48,1,0.0006408997944664499,mean,0.0005465701429880778,COMPLETE
